{
  "$schema": "./layout-schema.json",
  "version": "1.1.0",
  "name": "SemiconFab 300mm Advanced Node Balanced Pilot Layout",
  "description": "Balanced cleanroom floor plan (121 tools) calibrated for advanced-node logic manufacturing flow: 1:1 Litho-Track pairing (8:8), 2.25x Etch/CVD multi-patterning ratios (18:18), and dedicated packaging annex. 本洁净室为 SemiconFab 概念验证与全谱系设备编目孪生沙盒，集成了前道与后道代表性设备，但机台数量显著少于实际先进制程Fab。",
  "created_at": "2026-10-14T20:45:00Z",
  "updated_at": "2026-10-14T20:45:00Z",
  "author": "SemiconFab Consortium (Balanced Node Revision)",
  "tools": [
    {
      "tool_id": "bd4d925d-d8b3-402a-99b8-ffdaf56ef504",
      "vendor": "ASML",
      "model": "TWINSCAN NXT:2050i",
      "category": "lithography",
      "bay": "lithography",
      "x": -31.0,
      "z": -22.5,
      "rotation": 0
    },
    {
      "tool_id": "c1bfa44c-32fe-4ec3-8985-86408777ca84",
      "vendor": "ASML",
      "model": "TWINSCAN NXT:2000i",
      "category": "lithography",
      "bay": "lithography",
      "x": -24.0,
      "z": -22.5,
      "rotation": 180
    },
    {
      "tool_id": "28b4f15d-d8ae-4484-b143-dbb701fa5499",
      "vendor": "ASML",
      "model": "TWINSCAN NXE:3400C",
      "category": "lithography",
      "bay": "lithography",
      "x": -31.0,
      "z": -17.5,
      "rotation": 0
    },
    {
      "tool_id": "65516385-77d1-4c9a-874c-72e109623bf2",
      "vendor": "ASML",
      "model": "TWINSCAN NXE:3600D",
      "category": "lithography",
      "bay": "lithography",
      "x": -24.0,
      "z": -17.5,
      "rotation": 180
    },
    {
      "tool_id": "5717e2ed-8b3f-422f-813b-7c4881cc2b47",
      "vendor": "ASML",
      "model": "TWINSCAN NXE:3800E",
      "category": "lithography",
      "bay": "lithography",
      "x": -31.0,
      "z": -12.5,
      "rotation": 0
    },
    {
      "tool_id": "68ce56dd-56d8-4261-9373-b6c62a1a4934",
      "vendor": "ASML",
      "model": "TWINSCAN EXE:5000",
      "category": "lithography",
      "bay": "lithography",
      "x": -24.0,
      "z": -12.5,
      "rotation": 180
    },
    {
      "tool_id": "d188133d-161d-476a-8e0c-33ad03eb54f4",
      "vendor": "ASML",
      "model": "TWINSCAN EXE:5200 / 5200B",
      "category": "lithography",
      "bay": "lithography",
      "x": -31.0,
      "z": -7.5,
      "rotation": 0
    },
    {
      "tool_id": "aac589b2-a1b5-4234-a8a1-681ee72b15fe",
      "vendor": "Nikon",
      "model": "NSR-S635E",
      "category": "lithography",
      "bay": "lithography",
      "x": -24.0,
      "z": -7.5,
      "rotation": 180
    },
    {
      "tool_id": "4019337c-50d3-4d36-a73f-2d68ea5732d9",
      "vendor": "Tokyo Electron",
      "model": "CLEAN TRACK ACT 12",
      "category": "resist_track",
      "bay": "resist_track",
      "x": -32.75,
      "z": -1.5,
      "rotation": 0
    },
    {
      "tool_id": "4abd7a15-23e0-429d-94b4-01e0eafc705b",
      "vendor": "Tokyo Electron",
      "model": "CLEAN TRACK LITHIUS Pro Z",
      "category": "resist_track",
      "bay": "resist_track",
      "x": -29.25,
      "z": -1.5,
      "rotation": 0
    },
    {
      "tool_id": "4019337c-50d3-4d36-a73f-2d68ea5732d9",
      "vendor": "Tokyo Electron",
      "model": "CLEAN TRACK ACT 12",
      "category": "resist_track",
      "bay": "resist_track",
      "x": -25.75,
      "z": -1.5,
      "rotation": 0
    },
    {
      "tool_id": "4abd7a15-23e0-429d-94b4-01e0eafc705b",
      "vendor": "Tokyo Electron",
      "model": "CLEAN TRACK LITHIUS Pro Z",
      "category": "resist_track",
      "bay": "resist_track",
      "x": -22.25,
      "z": -1.5,
      "rotation": 0
    },
    {
      "tool_id": "4019337c-50d3-4d36-a73f-2d68ea5732d9",
      "vendor": "Tokyo Electron",
      "model": "CLEAN TRACK ACT 12",
      "category": "resist_track",
      "bay": "resist_track",
      "x": -32.75,
      "z": 4.5,
      "rotation": 180
    },
    {
      "tool_id": "4abd7a15-23e0-429d-94b4-01e0eafc705b",
      "vendor": "Tokyo Electron",
      "model": "CLEAN TRACK LITHIUS Pro Z",
      "category": "resist_track",
      "bay": "resist_track",
      "x": -29.25,
      "z": 4.5,
      "rotation": 180
    },
    {
      "tool_id": "4019337c-50d3-4d36-a73f-2d68ea5732d9",
      "vendor": "Tokyo Electron",
      "model": "CLEAN TRACK ACT 12",
      "category": "resist_track",
      "bay": "resist_track",
      "x": -25.75,
      "z": 4.5,
      "rotation": 180
    },
    {
      "tool_id": "4abd7a15-23e0-429d-94b4-01e0eafc705b",
      "vendor": "Tokyo Electron",
      "model": "CLEAN TRACK LITHIUS Pro Z",
      "category": "resist_track",
      "bay": "resist_track",
      "x": -22.25,
      "z": 4.5,
      "rotation": 180
    },
    {
      "tool_id": "c023cab6-8aea-45ef-9c22-a4a04fec4ff8",
      "vendor": "Lam Research",
      "model": "2300 Versys Kiyo3x / Kiyo F series",
      "category": "dry_etch",
      "bay": "dry_etch",
      "x": -10.5,
      "z": -23.5,
      "rotation": 0
    },
    {
      "tool_id": "08fa539c-99af-4ea4-b925-8f8dc302784f",
      "vendor": "Lam Research",
      "model": "Flex G Series",
      "category": "dry_etch",
      "bay": "dry_etch",
      "x": -10.5,
      "z": -19.5,
      "rotation": 0
    },
    {
      "tool_id": "cecf6e2a-d3c8-49f2-88a5-a40022bf97bc",
      "vendor": "Lam Research",
      "model": "2300 Syndion / Syndion GP",
      "category": "dry_etch",
      "bay": "dry_etch",
      "x": -10.5,
      "z": -15.5,
      "rotation": 0
    },
    {
      "tool_id": "debc8dd8-9d16-465e-9743-ceff620d59b4",
      "vendor": "Lam Research",
      "model": "Vantex",
      "category": "dry_etch",
      "bay": "dry_etch",
      "x": -10.5,
      "z": -11.5,
      "rotation": 0
    },
    {
      "tool_id": "04414ac5-0d7f-4722-8397-ecf9f31549b7",
      "vendor": "Tokyo Electron",
      "model": "Tactras Vigus",
      "category": "dry_etch",
      "bay": "dry_etch",
      "x": -10.5,
      "z": -7.5,
      "rotation": 0
    },
    {
      "tool_id": "76cb067a-f330-432a-816a-dd371c64cbc4",
      "vendor": "Tokyo Electron",
      "model": "Tactras-UDEMAE",
      "category": "dry_etch",
      "bay": "dry_etch",
      "x": -6.5,
      "z": -23.5,
      "rotation": 0
    },
    {
      "tool_id": "d1294fff-4960-4d98-8786-bfdf4ee5cc8d",
      "vendor": "Applied Materials",
      "model": "Centura AdvantEdge (Mesa)",
      "category": "dry_etch",
      "bay": "dry_etch",
      "x": -6.5,
      "z": -19.5,
      "rotation": 0
    },
    {
      "tool_id": "b0f6d513-4783-4093-be3a-5a1347536816",
      "vendor": "Applied Materials",
      "model": "Producer Etch",
      "category": "dry_etch",
      "bay": "dry_etch",
      "x": -6.5,
      "z": -15.5,
      "rotation": 0
    },
    {
      "tool_id": "0b8893cd-7fa7-447e-a265-f020167ede29",
      "vendor": "Hitachi High-Tech",
      "model": "M-8000 Series (Conductor Etch)",
      "category": "dry_etch",
      "bay": "dry_etch",
      "x": -6.5,
      "z": -11.5,
      "rotation": 0
    },
    {
      "tool_id": "879e6a81-948c-49ff-a0b3-e40e4e326630",
      "vendor": "Hitachi High-Tech",
      "model": "EMCP Etch Chamber",
      "category": "dry_etch",
      "bay": "dry_etch",
      "x": -6.5,
      "z": -7.5,
      "rotation": 0
    },
    {
      "tool_id": "ed73be38-243e-4492-b8cf-e0e470a70315",
      "vendor": "AMEC",
      "model": "Primo HD-RIE",
      "category": "dry_etch",
      "bay": "dry_etch",
      "x": -2.5,
      "z": -23.5,
      "rotation": 180
    },
    {
      "tool_id": "6e6d2c65-59d1-4ba5-8124-1b005e859e37",
      "vendor": "AMEC",
      "model": "Primo XD-RIE",
      "category": "dry_etch",
      "bay": "dry_etch",
      "x": -2.5,
      "z": -19.5,
      "rotation": 180
    },
    {
      "tool_id": "06427346-01c6-4b73-9bd4-fbe20106d430",
      "vendor": "NAURA",
      "model": "(model not disclosed)",
      "category": "dry_etch",
      "bay": "dry_etch",
      "x": -2.5,
      "z": -15.5,
      "rotation": 180
    },
    {
      "tool_id": "8e6c2ce9-7afa-4bf4-adb7-ca0c1f825104",
      "vendor": "NAURA",
      "model": "NMC612H",
      "category": "dry_etch",
      "bay": "dry_etch",
      "x": -2.5,
      "z": -11.5,
      "rotation": 180
    },
    {
      "tool_id": "b43079c2-0f64-4323-aab2-3f2658d6e763",
      "vendor": "NAURA",
      "model": "Acme Glaion130",
      "category": "dry_etch",
      "bay": "dry_etch",
      "x": 1.5,
      "z": -23.5,
      "rotation": 180
    },
    {
      "tool_id": "c023cab6-8aea-45ef-9c22-a4a04fec4ff8",
      "vendor": "Lam Research",
      "model": "2300 Versys Kiyo3x / Kiyo F series",
      "category": "dry_etch",
      "bay": "dry_etch",
      "x": 1.5,
      "z": -19.5,
      "rotation": 180
    },
    {
      "tool_id": "08fa539c-99af-4ea4-b925-8f8dc302784f",
      "vendor": "Lam Research",
      "model": "Flex G Series",
      "category": "dry_etch",
      "bay": "dry_etch",
      "x": 1.5,
      "z": -15.5,
      "rotation": 180
    },
    {
      "tool_id": "cecf6e2a-d3c8-49f2-88a5-a40022bf97bc",
      "vendor": "Lam Research",
      "model": "2300 Syndion / Syndion GP",
      "category": "dry_etch",
      "bay": "dry_etch",
      "x": 1.5,
      "z": -11.5,
      "rotation": 180
    },
    {
      "tool_id": "d3a0d8d2-04e3-4c55-8440-13021509246c",
      "vendor": "Applied Materials",
      "model": "Producer GT",
      "category": "thin_film_deposition",
      "bay": "thin_film_deposition",
      "x": 13.5,
      "z": -23.5,
      "rotation": 0
    },
    {
      "tool_id": "7f907090-34b3-4c03-ab9b-595d9e7b95c0",
      "vendor": "Applied Materials",
      "model": "Endura 5500/XP",
      "category": "thin_film_deposition",
      "bay": "thin_film_deposition",
      "x": 13.5,
      "z": -19.5,
      "rotation": 0
    },
    {
      "tool_id": "39485d63-6466-4262-bfef-89845cf2cde4",
      "vendor": "Lam Research",
      "model": "Vector Extreme",
      "category": "thin_film_deposition",
      "bay": "thin_film_deposition",
      "x": 13.5,
      "z": -15.5,
      "rotation": 0
    },
    {